{
 "schema_version": "evaluation-run-manifest/v1",
 "run_id": "run-20260922T141129Z-f70402e",
 "generated_at": "2026-09-22T14:11:29Z",
 "git_commit": "f70402e5b852923028283c93f81dbfb12f1911f4",
 "git_dirty": true,
 "engine_version": "phase4c.1-b/research-contract-1",
 "engine_hashes": {
  "research_answer": {
   "path": "_scripts/_tools/research_answer.py",
   "sha256": "89e47ef3c93ef8a86558b9eb5082fffda870de33590c5d68b6161f52ff543d83",
   "size": 56727
  },
  "research_agent": {
   "path": "_scripts/_tools/lacan_mcp/research_agent.py",
   "sha256": "629e2697543f0e1b618ad0a010e644cb5b1a598b7fde541b86ff027abcb75516",
   "size": 29478
  },
  "evidence_sufficiency_v2": {
   "path": "_scripts/_tools/lacan_mcp/evidence_sufficiency_v2.py",
   "sha256": "16124cd3c36e9a8bbfcd43c51992bf81abd3ad12db2e0d81888e2dc693ee592a",
   "size": 24344
  },
  "evidence_sufficiency_v1": {
   "path": "_scripts/_tools/lacan_mcp/evidence_sufficiency.py",
   "sha256": "81773e72779da5d2572b38611cd9e6d243d29a138b9d9658db819223549b1487",
   "size": 14934
  },
  "knowledge_api": {
   "path": "_scripts/_tools/lacan_mcp/knowledge_api.py",
   "sha256": "3d9af69902f8b4c7c3652a177fdeeeb732fd5801b6a9eaaaf7faa7e512e7671d",
   "size": 83446
  },
  "ontology_gaps": {
   "path": "_scripts/_tools/lacan_mcp/ontology_gaps.py",
   "sha256": "efbef07052d32993f8b4468b263491cd0fd7dcfa77176114794c69b559cf2ed3",
   "size": 16510
  },
  "citations": {
   "path": "_scripts/_tools/lacan_mcp/citations.py",
   "sha256": "4c7f5d5b2b220c1cbe7cf0e090e2776b0d04ab365c327579d27285589ba09966",
   "size": 8331
  },
  "gold_normalization": {
   "path": "_scripts/_tools/gold_normalization.py",
   "sha256": "c9a19200c38ba1c3486df10a474682fbc188f1e3fe50dbe70f51ed912606bc46",
   "size": 15019
  },
  "eval_integrity": {
   "path": "_scripts/_tools/eval_integrity.py",
   "sha256": "b96369874613ced4a96f01ba8e84e00c72808412e8793c345b9ace7d52c8f31c",
   "size": 31711
  },
  "research_contract": {
   "path": "_scripts/_tools/research_contract.py",
   "sha256": "591fc4fddb4e9a51f0e6d6e1ae99cb27177548755f367dde26261590d0762284",
   "size": 48802
  },
  "evidence_sufficiency_v21": {
   "path": "_scripts/_tools/evidence_sufficiency_v21.py",
   "sha256": "18d52a0548d558c20ec04856ed5118644e1ef2cdae534e36cded6a73caf495f9",
   "size": 8459
  },
  "run_diagnostic_4c1b": {
   "path": "_scripts/_tools/run_diagnostic_4c1b.py",
   "sha256": "fa63272c9481e9a167a04e0cb9771c0a7c82c050bb313dfe14145e54f860b133",
   "size": 6491
  },
  "build_gold_v2": {
   "path": "_scripts/_tools/build_gold_v2.py",
   "sha256": "3a4315a2dda9631a786187fea17813b5fb554a6966dd4e728ebfba833fd9d966",
   "size": 17784
  }
 },
 "engine_hash": "1bd97a91fbaa232708adcd1f55dfda002680eaf375e5ad98ef4656c1a7a0a929",
 "data_hashes": {
  "research_tasks_v1": {
   "path": "_data/eval/research_tasks_v1.jsonl",
   "sha256": "de27eb12326c81d7b925f79109cd0475412de264bf042bfa6e0a1aab9ca769df",
   "size": 393844
  },
  "gold_derivation_v1": {
   "path": "_data/eval/research_tasks_v1.gold_derivation.json",
   "sha256": "3dd8a476f19e5d23283411f643978f7da7faa9a8ebb21a214a3ca93d7151b08a",
   "size": 38585
  },
  "research_eval_results_v4c": {
   "path": "_data/eval/research_eval_results.v4c.json",
   "sha256": "b07d08cca04a18c951813a7d22cf4ade1fe16d780a8362840dcd60a855c51a8a",
   "size": 121812
  },
  "human_review_records": {
   "path": "_data/eval/research_human_review.jsonl",
   "sha256": "a14ea5316ccaaf90f95e197f9674bca9620848fcc726a1bd5d4c9694fe4bfb3d",
   "size": 176445
  },
  "human_adjudication_queue": {
   "path": "_data/eval/human_adjudication_queue.jsonl",
   "sha256": "acf69693a6cdc3adbec1da8c2131618f15b47aa3dec10815becef76c0f6b4dcb",
   "size": 9155
  },
  "human_review_results_v1": {
   "path": "_data/eval/human_review_results_v1.json",
   "sha256": "43a3438bebb8961169e12f97d0cad4b7da24c07a35823f4073463617c1fa6168",
   "size": 17053
  },
  "seminars": {
   "path": "_data/passage_store/seminars.jsonl",
   "sha256": "0459cd6b8e718a443c0e25923d4fbde44e7cc9eb8cf07c2b1e32aa1d5f29638a",
   "size": 14431
  },
  "ontology_entities_v4a1": {
   "path": "_data/ontology/v4a1/entities.jsonl",
   "sha256": "fbf998e2d68b62ccfe040ea0378bb33f15a87cdb93396e69f452f8d926eb6d57",
   "size": 18041
  },
  "ontology_term_mappings_v4a1": {
   "path": "_data/ontology/v4a1/term_mappings.jsonl",
   "sha256": "7594c9f2dc37d3e6a4ba7fe61878c2181631c3b35f2e39f3c62d51dedda8f043",
   "size": 3970
  },
  "alias_index": {
   "path": "_data/index/alias_index.jsonl",
   "sha256": "4965510204eca049d3e0adc8263ae16eb7bf845453cf4686f71bc394dc337ab7",
   "size": 196967
  },
  "terminology_bridge": {
   "path": "_data/terminology_bridge.jsonl",
   "sha256": "6e7646d9d064938cd0cf4db63af4cdd129daf49989af7235f2107d0ad0308c99",
   "size": 1361647
  },
  "gold_v2_tasks": {
   "path": "_data/eval/gold_v2/research_tasks_v2.jsonl",
   "sha256": "80465fb42aa9d8b401e475dd018fcc37aa810177a50201a99294f5e6c28544f2",
   "size": 144049
  },
  "gold_v2_overrides": {
   "path": "_data/eval/gold_v2/lane_overrides_v1.json",
   "sha256": "7b1e48668d83851c8abfccae1ca28492033331b3a40bdb27bee94598f9dd9dcc",
   "size": 4026
  },
  "manual_review_lanes": {
   "path": "_data/eval/gold_v2/manual_review_lanes_v1.json",
   "sha256": "89aca6f379ae28607aabca1a42881b395c8d3bbd11a7c9ef0e2318629966689b",
   "size": 22261
  },
  "scholarly_regression": {
   "path": "_data/eval/scholarly_regression_v1.jsonl",
   "sha256": "21a44ae328503a831134e21cb1568248d291c5820fda04ab4407940cabd55723",
   "size": 48449
  },
  "gold_lane_audit": {
   "path": "_data/eval/gold_lane_audit_v1.jsonl",
   "sha256": "5505cc2db717dff51c1023a83105b919e80c803c43be0207b54a24a6048e6085",
   "size": 59413
  },
  "trace_integrity_baseline": {
   "path": "_data/eval/trace_integrity_baseline_v1.json",
   "sha256": "259fcfbfe98212141f75037ca44c405943c02430a87027dd6f9e6defbb751f1a",
   "size": 10545
  },
  "diagnostic_results_4c1b": {
   "path": "_data/eval/research_eval_results.4c1b.json",
   "sha256": "4b66eb15107f1c063bc570c3c9aed96d762ac4f34a55b96fa974e8e235f037d7",
   "size": 154490
  }
 },
 "ontology_version": "24eae522ebad7932a622c31379593d425b9307bcbec4e2a25cfd92720a424ebf",
 "passage_store_version": "b1576db33280a3d83e46e2d854457c7ab071e0e9c4068b8022ea1f0b2a417b70",
 "passage_store": {
  "passage_store": {
   "path": "_data/passage_store/passages.jsonl",
   "sha256": "889dd5f9afec6053befd91e1ae6eccbd0035be3ea7d2b77f1a5a242694fd0a01",
   "size": 433758357,
   "n_lines": 249105
  }
 },
 "gold_version": "04638a4ec01845fa13f2f4aa80f062a7eb12c14beeeab2dc3a9112ddfdee0bd3",
 "task_set_version": "05cc994f670ebc7e26d7cb270248a29a95d33c1b72877d634cbc696b8dc9157c",
 "schema_versions": {
  "research_trace": "research-trace/v2（4C.1-B 起；历史 trace 为 research-trace-4b/v1）",
  "research_contract": "research-contract/v1",
  "gold": "research-task/v2（gold_v2；v1 为 research-task/v1，只读保留）",
  "research_answer": "research-answer-4b/v1",
  "evidence_pack": "evidence-pack/v1",
  "gold_lane_audit": "gold-lane-audit/v1",
  "scholarly_regression": "scholarly-regression/v1",
  "evaluation_run_manifest": "evaluation-run-manifest/v1"
 },
 "artifacts": {
  "gold_lane_audit": "_data/eval/gold_lane_audit_v1.jsonl",
  "scholarly_regression": "_data/eval/scholarly_regression_v1.jsonl",
  "adjudicated_truth": "_data/eval/evaluation_truth_adjudicated_v1.json",
  "lane_semantics": "_data/eval/lane_semantics_v1.json",
  "failure_class_mapping": "_data/eval/failure_class_mapping_v1.json",
  "trace_integrity_baseline": "_data/eval/trace_integrity_baseline_v1.json",
  "evaluation_integrity_audit": "_data/eval/evaluation_integrity_audit.json",
  "frozen_phase4c_results": "_data/eval/research_eval_results.v4c.json"
 },
 "notes": "历史 frozen trace（_data/eval/research_traces_4b/）**没有**本清单，因此不可从任何 commit 完整重现 —— 这正是 Phase 4C 审计的结论；新 run 必须声明 research-trace/v2 并写出本清单。"
}